email,password,host,port,secure
vfddyijfrxgftuutruoiy1@gmail.com,ctvr swja esfb tigx,smtp.gmail.com,587,false
bgfghgh4@gmail.com,brdh xrse pzba hplj,smtp.gmail.com,587,false
fck154055@gmail.com,atps pmqz mzzp ukfj,smtp.gmail.com,587,false
ugffhkjftrdfhkucfgj@gmail.com,hcsh hmfe dxvh kynt,smtp.gmail.com,587,false
ffyddghvcxcfggxghjb@gmail.com,kdsa qbqp vikh hrky,smtp.gmail.com,587,false
bsvsbsbsvhsushsbejejhehe49@gmail.com,uivo exxv ewxx sivq,smtp.gmail.com,587,false
jcyvhhchhyhggvgfhyygufd@gmail.com,oewp ezln dulk vyas,smtp.gmail.com,587,false
jbffyiyddfuiihjjuhgffgjjj96@gmail.com,igzj anul psrn ozly,smtp.gmail.com,587,false
gffguuuthjhvvfgjjgghjhnb193@gmail.com,pkrr tqin xdxt cews,smtp.gmail.com,587,false